<?xml version="1.0" encoding="ISO-8859-1" ?><!DOCTYPE playlist SYSTEM "http://play.0pen.us/ext/xml/playlist.dtd"><playlist name="" basedir="" xmlns="http://play.0pen.us/ext/xml/dtd/"><file src="/home/admire/play/system/upload/hit.png"><file src="/home/admire/play/system/upload/hit.png"><file src="/home/admire/play/system/upload/background1.png"></playlist><?xml version="1.0" encoding="ISO-8859-1" ?><!DOCTYPE playlist SYSTEM "http://play.0pen.us/ext/xml/playlist.dtd"><playlist name="" basedir="" xmlns="http://play.0pen.us/ext/xml/dtd/"><file src="/home/admire/play/system/upload/hit.png"><file src="/home/admire/play/system/upload/hit.png"><file src="/home/admire/play/system/upload/background1.png"></playlist><?xml version="1.0" encoding="ISO-8859-1" ?><!DOCTYPE playlist SYSTEM "http://play.0pen.us/ext/xml/playlist.dtd"><playlist name="" basedir="" xmlns="http://play.0pen.us/ext/xml/dtd/"><file src="/home/admire/play/system/upload/hit.png"><file src="/home/admire/play/system/upload/hit.png"><file src="/home/admire/play/system/upload/background1.png"></playlist><?xml version="1.0" encoding="ISO-8859-1" ?><!DOCTYPE playlist SYSTEM "http://play.0pen.us/ext/xml/playlist.dtd"><playlist name="" basedir="" xmlns="http://play.0pen.us/ext/xml/dtd/"><file src="/home/admire/play/system/upload/hit.png"><file src="/home/admire/play/system/upload/hit.png"><file src="/home/admire/play/system/upload/background1.png"></playlist><?xml version="1.0" encoding="ISO-8859-1"?><!DOCTYPE playlist SYSTEM "http://play.0pen.us/ext/xml/playlist.dtd"><playlist name="" basedir="" xmlns="http://play.0pen.us/ext/xml/dtd/"><file src="/home/admire/play/system/upload/hit.png"><file src="/home/admire/play/system/upload/hit.png"><file src="/home/admire/play/system/upload/background1.png"></playlist><?xml version="1.0" encoding="ISO-8859-1"?><!DOCTYPE playlist SYSTEM "http://play.0pen.us/ext/xml/playlist.dtd"><playlist name="" basedir="" xmlns="http://play.0pen.us/ext/xml/dtd/"><file src="/home/admire/play/system/upload/hit.png"><file src="/home/admire/play/system/upload/hit.png"><file src="/home/admire/play/system/upload/background1.png"></playlist><?xml version="1.0" encoding="ISO-8859-1"?><!DOCTYPE playlist SYSTEM "http://play.0pen.us/ext/xml/playlist.dtd"><playlist name="" basedir="" xmlns="http://play.0pen.us/ext/xml/dtd/">